{
  "userId": "usr_clinician_001",
  "workspaceId": "wsp_clinic_001",
  "notifications": [
    {
      "id": "noti_001",
      "userId": "usr_clinician_001",
      "workspaceId": "wsp_clinic_001",
      "organizationId": "wsp_clinic_001",
      "type": "appointment_scheduled",
      "title": "Lịch hẹn mới",
      "message": "Một lịch hẹn mới đã được xác nhận trong workspace hiện tại.",
      "campaignId": "",
      "audienceType": "direct",
      "audienceRole": "doctor",
      "requestedChannels": [
        "in_app",
        "push"
      ],
      "inAppStatus": "ready",
      "emailStatus": "skipped",
      "pushStatus": "sent",
      "read": false,
      "readAt": null,
      "createdAt": "2026-07-29T08:00:00.000Z",
      "updatedAt": "2026-07-29T08:00:00.000Z"
    }
  ],
  "updatedAt": "2026-07-29T08:00:01.000Z"
}
